hotel_name_,stars,location,review_rating,description,main_facilities,total_reviews,sub_ratings,sub_ratings_categories,sub_ratings_dict,hotel_surroundings,hotel_surroundings_distance,surroundings_dict,room_type,price_list,cheapest_price,facilities_groups,all_facilities,link
RedDoorz The Providence Tower - Vaccinated Staff,2,"The Providence Tower Manila, Leon Guinto Street, Corner Estrada St., 1004 Manila, Philippines",6.9,"Located within 1.9 km of Manila Bay Beach and 2.6 km of World Trade Center Metro Manila, RedDoorz The Providence Tower - Vaccinated Staff has rooms with air conditioning and a private bathroom in Manila. The property is around 3.7 km from Rizal Park, 4.2 km from Intramuros and 4.5 km from Greenbelt Mall. The property is 5.1 km from SM by the Bay Amusement Park and 5.1 km from Mall of Asia Arena. The rooms in the hotel are equipped with a TV. At RedDoorz The Providence Tower - Vaccinated Staff the rooms include bed linen and towels. Guests at the accommodation can enjoy a à la carte or an Asian breakfast. Glorietta Mall is 5 km from RedDoorz The Providence Tower - Vaccinated Staff, while Manila Cathedral is 5.1 km from the property. The nearest airport is Ninoy Aquino International Airport, 8 km from the hotel. ","['Non Smoking Rooms', 'Fitness Room', 'Free WiFi Internet Access Included', 'Laundry', 'Elevator', 'breakfast', 'Non Smoking Rooms', 'Fitness Room', 'Free WiFi Internet Access Included', 'Laundry', 'Elevator', 'breakfast']",20,"['7.9', '6.7', '7.2', '7.1', '7.2', '8.0', '9.2']","['Staff', 'Facilities', 'Cleanliness', 'Comfort', 'Value for money', 'Location', 'Free WiFi']","{'Staff': '7.9', 'Facilities': '6.7', 'Cleanliness': '7.2', 'Comfort': '7.1', 'Value for money': '7.2', 'Location': '8.0', 'Free WiFi': '9.2'}","['Marian Quadrangle', 'Amphitheater', ""MMDA Children's Road Safety Park"", 'Manila Zoological and Botanical Garden', 'Remedios Circle', 'ASEAN Garden', 'Rajah Sulayman Park', 'Manila Baywalk', 'Pedro Gil Park', 'Plaza Dilao', 'Restaurant', 'Restaurant', 'Restaurant', 'Cafe/Bar', 'Cafe/Bar', 'Cafe/Bar', 'Paco Park', 'GT International Tower', 'Museo Pambata', 'National Museum of the Philippines', 'Ninoy Aquino Monument', 'Malacanang Palace', 'Intramuros', 'Fort Santiago', 'Pinto Art Museum', 'Casa Santa Museum', 'Ocean/Sea', 'Manila Bay Beach', 'Train', 'Train', 'Subway', 'Subway', 'Ninoy Aquino International Airport', 'Subic Bay Airport', 'Clark International Airport']","['200 m', '200 m', '700 m', '700 m', '1.1 km', '1.1 km', '1.3 km', '1.5 km', '1.8 km', '1.8 km', '20 m', '20 m', '30 m', '40 m', '100 m', '200 m', '2 km', '2.4 km', '2.5 km', '2.9 km', '3 km', '3.3 km', '3.5 km', '4.2 km', '18 km', '20 km', '2 km', '1.4 km', '150 m', '700 m', '3.1 km', '4 km', '6 km', '82 km', '84 km']","{'Marian Quadrangle': '200 m', 'Amphitheater': '200 m', ""MMDA Children's Road Safety Park"": '700 m', 'Manila Zoological and Botanical Garden': '700 m', 'Remedios Circle': '1.1 km', 'ASEAN Garden': '1.1 km', 'Rajah Sulayman Park': '1.3 km', 'Manila Baywalk': '1.5 km', 'Pedro Gil Park': '1.8 km', 'Plaza Dilao': '1.8 km', 'Restaurant': '30 m', 'Cafe/Bar': '200 m', 'Paco Park': '2 km', 'GT International Tower': '2.4 km', 'Museo Pambata': '2.5 km', 'National Museum of the Philippines': '2.9 km', 'Ninoy Aquino Monument': '3 km', 'Malacanang Palace': '3.3 km', 'Intramuros': '3.5 km', 'Fort Santiago': '4.2 km', 'Pinto Art Museum': '18 km', 'Casa Santa Museum': '20 km', 'Ocean/Sea': '2 km', 'Manila Bay Beach': '1.4 km', 'Train': '700 m', 'Subway': '4 km', 'Ninoy Aquino International Airport': '6 km', 'Subic Bay Airport': '82 km', 'Clark International Airport': '84 km'}","['Standard Double Room', 'Standard Double Room', 'Standard Double Room', 'Standard Double Room', 'Deluxe Room', 'Deluxe Room', 'Deluxe Room', 'Deluxe Room', 'Executive Suite', 'Executive Suite', 'Executive Suite', 'Queen Room', 'Queen Room', 'Queen Room', 'Queen Room']","[1074.0, 1392.0, 2784.0, 2984.0, 1560.0, 2075.0, 2145.0, 2283.0, 1560.0, 3120.0, 3320.0, 1813.0, 2392.0, 2493.0, 2631.0]",1074.0,"['Bathroom', 'Bedroom', 'Media & Technology', 'Parking', 'Services', 'Safety & security', 'General', 'Accessibility', 'Spa', 'Languages Spoken']","[['Toilet paper', 'Towels', 'Towels/Sheets (extra fee)', 'Private Bathroom', 'Toilet', 'Free toiletries', 'Shower'], ['Linens'], ['TV'], ['Laundry', 'Meeting/Banquet facilities'], ['Fire extinguishers', 'CCTV in common areas', 'Smoke alarms', 'Security alarm', 'Key access', '24-hour security'], ['Adults only', 'Designated smoking area', 'Air conditioning', 'Elevator', 'Non-smoking rooms'], ['Upper floors accessible by elevator'], ['Fitness center'], ['English', 'Filipino']]",https://www.booking.com/hotel/ph/reddoorz-the-providence-tower.html?label=gen173nr-1FCAEoggI46AdIM1gEaLQBiAEBmAEJuAEXyAEM2AEB6AEB-AELiAIBqAIDuALa9-ebBsACAdICJDNiMWUxMTlhLTc3ODEtNGI3NC05MWVlLTQ5MDA0MDQzYzY5NNgCBuACAQ&sid=b3a20c12be6b3d4d9b1b0a71b11d8898&aid=304142&ucfs=1&arphpl=1&checkin=2022-12-01&checkout=2022-12-02&dest_id=-2437894&dest_type=city&group_adults=2&req_adults=2&no_rooms=1&group_children=0&req_children=0&hpos=12&hapos=162&sr_order=popularity&nflt=ht_id%3D204&srpvid=7ca3572c9035002e&srepoch=1669119872&all_sr_blocks=688361103_0_2_0_0&highlighted_blocks=688361103_0_2_0_0&matching_block_id=688361103_0_2_0_0&sr_pri_blocks=688361103_0_2_0_0__1873&tpi_r=1&from=searchresults#hotelTmpl
Herald Suites - Multiple Use Hotel,3,"2168 Don Chino Roces Avenue, Makati, 1231 Manila, Philippines",8.1,"Located in the financial district of Makati, Herald Suites is 0.6 mi from the Ayala and Greenbelt Commercial Center. Hotel features 3 dining options and free Wi-Fi. Ninoy Aquino Airport is a 20-minute drive from Herald Suites. Airport shuttle service is offered. Little Tokyo and Rockwell Complex are a few blocks from the hotel. Rooms are equipped with IDD telephone lines, tea/coffer maker and cable television. There is also a mini-bar and a private bathroom. Herald Suites has a business center and a meeting room. Laundry and dry cleaning services are available. Coca Café serves sandwiches and salads and the Hatsu Hana Tei Japanese Restaurant features Japanese dishes. ","['Swimming pool', 'Airport Shuttle', 'Non Smoking Rooms', 'Room-service', 'Restaurant', 'Rooms/Facilities for Disabled', 'Free WiFi Internet Access Included', 'Coffee/Tea maker', 'Bar', 'breakfast', 'Swimming pool', 'Airport Shuttle', 'Non Smoking Rooms', 'Room-service', 'Restaurant', 'Rooms/Facilities for Disabled', 'Free WiFi Internet Access Included', 'Coffee/Tea maker', 'Bar', 'breakfast']",163,"['9.1', '8.1', '8.4', '8.3', '8.2', '8.4', '7.5']","['Staff', 'Facilities', 'Cleanliness', 'Comfort', 'Value for money', 'Location', 'Free WiFi']","{'Staff': '9.1', 'Facilities': '8.1', 'Cleanliness': '8.4', 'Comfort': '8.3', 'Value for money': '8.2', 'Location': '8.4', 'Free WiFi': '7.5'}","['Legazpi Active Park', 'GT International Tower', 'Ninoy Aquino Monument', 'Pasay City Cockpit', 'Jaime C. Velasquez Park', 'Palm Promenade Park', 'Sultan Kudarat Monument Park', 'General Pio Del Pilar Monument Park', 'Jazz Park', 'Urdaneta Village Park', 'Restaurant', 'Cafe/Bar', 'Restaurant', 'Manila Zoological and Botanical Garden', 'Paco Park', 'Museo Pambata', 'Malacanang Palace', 'National Museum of the Philippines', 'Intramuros', 'Fort Santiago', 'Pinto Art Museum', 'Casa Santa Museum', 'Ocean/Sea', 'Manila Bay Beach', 'Train', 'Train', 'Subway', 'Subway', 'Ninoy Aquino International Airport', 'Subic Bay Airport', 'Clark International Airport']","['350 m', '750 m', '900 m', '1.1 km', '1.2 km', '1.2 km', '1.4 km', '1.5 km', '1.6 km', '1.7 km', '10 m', '10 m', '30 m', '3 km', '4.1 km', '4.8 km', '5 km', '5 km', '6 km', '7 km', '17 km', '18 km', '3.1 km', '3.8 km', '450 m', '600 m', '2.2 km', '5 km', '4.6 km', '84 km', '86 km']","{'Legazpi Active Park': '350 m', 'GT International Tower': '750 m', 'Ninoy Aquino Monument': '900 m', 'Pasay City Cockpit': '1.1 km', 'Jaime C. Velasquez Park': '1.2 km', 'Palm Promenade Park': '1.2 km', 'Sultan Kudarat Monument Park': '1.4 km', 'General Pio Del Pilar Monument Park': '1.5 km', 'Jazz Park': '1.6 km', 'Urdaneta Village Park': '1.7 km', 'Restaurant': '30 m', 'Cafe/Bar': '10 m', 'Manila Zoological and Botanical Garden': '3 km', 'Paco Park': '4.1 km', 'Museo Pambata': '4.8 km', 'Malacanang Palace': '5 km', 'National Museum of the Philippines': '5 km', 'Intramuros': '6 km', 'Fort Santiago': '7 km', 'Pinto Art Museum': '17 km', 'Casa Santa Museum': '18 km', 'Ocean/Sea': '3.1 km', 'Manila Bay Beach': '3.8 km', 'Train': '600 m', 'Subway': '5 km', 'Ninoy Aquino International Airport': '4.6 km', 'Subic Bay Airport': '84 km', 'Clark International Airport': '86 km'}","['Standard Double or Twin Room', 'Superior King Room', 'Standard Double or Twin Room']","[3646.0, 4104.0, 7600.0]",3646.0,"['Bathroom', 'Bedroom', 'View', 'Outdoors', 'Kitchen', 'Room Amenities', 'Living Area', 'Media & Technology', 'Food & Drink', 'Parking', 'Front Desk Services', 'Cleaning Services', 'Business Facilities', 'Safety & security', 'General', 'Accessibility', 'Outdoor swimming pool', 'Spa', 'Languages Spoken']","[['Toilet paper', 'Towels', 'Bidet', 'Bathtub or shower', 'Slippers', 'Private Bathroom', 'Toilet', 'Free toiletries', 'Hairdryer', 'Bathtub', 'Shower'], ['Linens', 'Wardrobe or closet', 'Alarm clock'], ['City view', 'View'], ['Garden'], ['Coffee machine', 'Cleaning products', 'Electric kettle', 'Refrigerator'], ['Socket near the bed', 'Clothes rack'], ['Sitting area', 'Desk'], ['Flat-screen TV', 'Cable channels', 'Telephone', 'TV'], ['Coffee house on site', 'Bar', 'Minibar', 'Restaurant', 'Tea/Coffee maker'], ['Invoice provided', 'Concierge', 'Baggage storage', 'Currency exchange', '24-hour front desk'], ['Daily housekeeping', 'Suit press', 'Ironing service', 'Dry cleaning', 'Laundry'], ['Fax/Photocopying', 'Business center', 'Meeting/Banquet facilities'], ['Fire extinguishers', 'CCTV outside property', 'CCTV in common areas', 'Smoke alarms', 'Security alarm', 'Key card access', 'Key access', '24-hour security', 'Safe'], ['Shuttle service', 'Shared lounge/TV area', 'Designated smoking area', 'Air conditioning', 'Wake-up service', 'Hardwood or parquet floors', 'Car rental', 'Packed lunches', 'Elevator', 'Family rooms', 'Ironing facilities', 'Facilities for disabled guests', 'Airport shuttle', 'Airport shuttle', 'Airport shuttle', 'Non-smoking rooms', 'Iron', 'Wake-up service/Alarm clock', 'Room service'], ['Upper floors accessible by stairs only', 'Upper floors accessible by elevator'], ['Pool with view', 'Pool/Beach towels', 'Beach chairs/Loungers', 'Fenced pool'], ['Full-body massage', 'Beach chairs/Loungers', 'Massage'], ['English', 'Japanese', 'Filipino']]",https://www.booking.com/hotel/ph/herald-suites.html?label=gen173nr-1FCAEoggI46AdIM1gEaLQBiAEBmAEJuAEXyAEM2AEB6AEB-AELiAIBqAIDuALa9-ebBsACAdICJDNiMWUxMTlhLTc3ODEtNGI3NC05MWVlLTQ5MDA0MDQzYzY5NNgCBuACAQ&sid=b3a20c12be6b3d4d9b1b0a71b11d8898&aid=304142&ucfs=1&arphpl=1&checkin=2022-12-01&checkout=2022-12-02&dest_id=-2437894&dest_type=city&group_adults=2&req_adults=2&no_rooms=1&group_children=0&req_children=0&hpos=17&hapos=167&sr_order=popularity&nflt=ht_id%3D204&srpvid=7ca3572c9035002e&srepoch=1669119872&all_sr_blocks=25888401_0_2_1_0&highlighted_blocks=25888401_0_2_1_0&matching_block_id=25888401_0_2_1_0&sr_pri_blocks=25888401_0_2_1_0__4475&tpi_r=1&from=searchresults#hotelTmpl
Heroes Hotel,3,"1260 Lemery Street cor. Osmena Highway, 1017 Manila, Philippines",8.6,"You're eligible for a Genius discount at Heroes Hotel! To save at this property, all you have to do is  Featuring free bikes, Heroes Hotel is located in Manila, 1.2 mi from Cultural Center of the Philippines. This 3-star hotel offers a 24-hour front desk and free WiFi. World Trade Center Metro Manila is 1.6 mi from the hotel and Century City is 1.8 mi away. At the hotel, rooms are fitted with a wardrobe. Each room is fitted with air conditioning, and some rooms at Heroes Hotel have a balcony and a bathtub. American buffet breakfast is served each morning at the property. The in-house restaurant serves international and steakhouse cuisine. A business center and a bicycle rental service are also offered by the accommodations. Greenbelt Mall is 1.8 mi from Heroes Hotel, while Rizal Park is 1.8 mi away. The nearest airport is Manila Ninoy Aquino International Airport, 4.3 mi from the property. ","['Airport Shuttle', 'Non Smoking Rooms', 'Fitness Room', 'Spa & Wellness Centre', 'Room-service', 'Free Parking', 'Bar', 'breakfast', 'Airport Shuttle', 'Non Smoking Rooms', 'Fitness Room', 'Spa & Wellness Centre', 'Room-service', 'Free Parking', 'Bar', 'breakfast']",402,"['9.2', '8.7', '8.9', '9.0', '8.9', '7.8', '7.7']","['Staff', 'Facilities', 'Cleanliness', 'Comfort', 'Value for money', 'Location', 'Free WiFi']","{'Staff': '9.2', 'Facilities': '8.7', 'Cleanliness': '8.9', 'Comfort': '9.0', 'Value for money': '8.9', 'Location': '7.8', 'Free WiFi': '7.7'}","['Amphitheater', 'Marian Quadrangle', 'Plaza Dilao', ""MMDA Children's Road Safety Park"", 'Manila Zoological and Botanical Garden', 'Remedios Circle', 'Plaza Felipe Calderon', 'Rajah Sulayman Park', 'Paco Park', 'ASEAN Garden', 'Cafe/Bar', 'Cafe/Bar', 'Restaurant', 'Restaurant', 'Restaurant', 'Cafe/Bar', 'GT International Tower', 'Ninoy Aquino Monument', 'Museo Pambata', 'National Museum of the Philippines', 'Malacanang Palace', 'Intramuros', 'Fort Santiago', 'Pinto Art Museum', 'Casa Santa Museum', 'Ocean/Sea', 'Manila Bay Beach', 'Train', 'Train', 'Subway', 'Subway', 'Ninoy Aquino International Airport', 'Subic Bay Airport', 'Clark International Airport']","['950 m', '1,000 m', '1.3 km', '1.3 km', '1.4 km', '1.6 km', '1.8 km', '1.9 km', '1.9 km', '1.9 km', '10 m', '10 m', '400 m', '400 m', '400 m', '500 m', '2 km', '2.6 km', '2.8 km', '2.9 km', '3 km', '3.6 km', '4.3 km', '18 km', '19 km', '2.7 km', '2 km', '300 m', '500 m', '3.5 km', '3.7 km', '6 km', '82 km', '84 km']","{'Amphitheater': '950 m', 'Marian Quadrangle': '1,000 m', 'Plaza Dilao': '1.3 km', ""MMDA Children's Road Safety Park"": '1.3 km', 'Manila Zoological and Botanical Garden': '1.4 km', 'Remedios Circle': '1.6 km', 'Plaza Felipe Calderon': '1.8 km', 'Rajah Sulayman Park': '1.9 km', 'Paco Park': '1.9 km', 'ASEAN Garden': '1.9 km', 'Cafe/Bar': '500 m', 'Restaurant': '400 m', 'GT International Tower': '2 km', 'Ninoy Aquino Monument': '2.6 km', 'Museo Pambata': '2.8 km', 'National Museum of the Philippines': '2.9 km', 'Malacanang Palace': '3 km', 'Intramuros': '3.6 km', 'Fort Santiago': '4.3 km', 'Pinto Art Museum': '18 km', 'Casa Santa Museum': '19 km', 'Ocean/Sea': '2.7 km', 'Manila Bay Beach': '2 km', 'Train': '500 m', 'Subway': '3.7 km', 'Ninoy Aquino International Airport': '6 km', 'Subic Bay Airport': '82 km', 'Clark International Airport': '84 km'}","['Deluxe Queen Room', 'Superior Double or Twin Room', 'Superior Double or Twin Room', 'Deluxe Queen Room', 'Deluxe Queen Room', 'Suite', 'Suite', ' Budget Quadruple Room', ' Budget Quadruple Room']","[1858.0, 2250.0, 2877.0, 2250.0, 2877.0, 4018.0, 4958.0, 3375.0, 4629.0]",1858.0,"['Bathroom', 'Bedroom', 'Kitchen', 'Room Amenities', 'Activities', 'Media & Technology', 'Food & Drink', 'Parking', 'Front Desk Services', 'Entertainment & Family Services', 'Cleaning Services', 'Business Facilities', 'Safety & security', 'General', 'Accessibility', 'Spa', 'Languages Spoken']","[['Toilet paper', 'Towels', 'Bidet', 'Towels/Sheets (extra fee)', 'Slippers', 'Private Bathroom', 'Toilet', 'Free toiletries', 'Shower'], ['Linens', 'Wardrobe or closet'], ['Electric kettle'], ['Socket near the bed', 'Clothes rack'], ['Bicycle rental'], ['Flat-screen TV', 'Cable channels', 'Telephone', 'TV'], ['Coffee house on site', 'Wine/Champagne', 'Bar', 'Restaurant'], ['Street parking', 'Accessible parking'], ['Invoice provided', 'Lockers', 'ATM on site', 'Baggage storage', 'Tour desk', 'Currency exchange', '24-hour front desk'], ['Board games/Puzzles'], ['Daily housekeeping', 'Ironing service', 'Dry cleaning', 'Laundry'], ['Business center', 'Meeting/Banquet facilities'], ['Fire extinguishers', 'CCTV outside property', 'CCTV in common areas', 'Smoke alarms', 'Security alarm', 'Key card access', '24-hour security', 'Safe'], ['Shuttle service', 'Convenience store on site', 'Designated smoking area', 'Air conditioning', 'Smoke-free property', 'Wake-up service', 'Tile/Marble floor', 'Heating', 'Elevator', 'Family rooms', 'Airport shuttle', 'Airport shuttle', 'Airport shuttle', 'Non-smoking rooms', 'Room service'], ['Upper floors accessible by elevator'], ['Fitness', 'Steam room', 'Spa facilities', 'Hot tub/Jacuzzi', 'Massage', 'Spa', 'Fitness center', 'Sauna'], ['English', 'Filipino']]",https://www.booking.com/hotel/ph/heroes.html?label=gen173nr-1FCAEoggI46AdIM1gEaLQBiAEBmAEJuAEXyAEM2AEB6AEB-AELiAIBqAIDuALa9-ebBsACAdICJDNiMWUxMTlhLTc3ODEtNGI3NC05MWVlLTQ5MDA0MDQzYzY5NNgCBuACAQ&sid=b3a20c12be6b3d4d9b1b0a71b11d8898&aid=304142&ucfs=1&arphpl=1&checkin=2022-12-01&checkout=2022-12-02&dest_id=-2437894&dest_type=city&group_adults=2&req_adults=2&no_rooms=1&group_children=0&req_children=0&hpos=18&hapos=168&sr_order=popularity&nflt=ht_id%3D204&srpvid=7ca3572c9035002e&srepoch=1669119872&all_sr_blocks=263660703_0_2_0_0&highlighted_blocks=263660703_0_2_0_0&matching_block_id=263660703_0_2_0_0&sr_pri_blocks=263660703_0_2_0_0__3243&tpi_r=1&from_sustainable_property_sr=1&from=searchresults#hotelTmpl
RedDoorz @ PIY Margal Sampaloc Manila,2,"El Grande Inn, 2114 PIY Margal Street, Sampaloc, 1008 Manila, Philippines",6.9,"You're eligible for a Genius discount at RedDoorz @ PIY Margal Sampaloc Manila! To save at this property, all you have to do is  Located within 1.9 km of Malacanang Palace and 4.2 km of Rizal Park, RedDoorz @ PIY Margal Sampaloc Manila has rooms with air conditioning and a private bathroom in Manila. The property is around 4.7 km from Intramuros, 5.6 km from Manila Cathedral and 5.6 km from Fort Santiago. Shangri-La Plaza is 7.6 km away and Power Plant Mall is 7.7 km from the hotel. The rooms in the hotel are equipped with a flat-screen TV with satellite channels. At RedDoorz @ PIY Margal Sampaloc Manila rooms come with bed linen and towels. An Asian breakfast is available each morning at the accommodation. World Trade Center Metro Manila is 7.2 km from RedDoorz @ PIY Margal Sampaloc Manila, while Smart Araneta Coliseum is 7.4 km from the property. The nearest airport is Ninoy Aquino International Airport, 15 km from the hotel. ","['Non Smoking Rooms', 'breakfast', 'Non Smoking Rooms', 'breakfast']",85,"['8.4', '6.5', '7.0', '6.9', '7.3', '7.4', '8.4']","['Staff', 'Facilities', 'Cleanliness', 'Comfort', 'Value for money', 'Location', 'Staff']","{'Staff': '8.4', 'Facilities': '6.5', 'Cleanliness': '7.0', 'Comfort': '6.9', 'Value for money': '7.3', 'Location': '7.4'}","['Rosarium Garden', 'La Loma Cockpit Arena', 'Quadricentennial Park', 'Plaza Mayor', 'Plaza Benavidez', 'Celadon Park', 'University Parade Grounds', 'Norberto S. Amoranto Park', 'Tan Yan Kee Garden', 'Freedom Park', 'Restaurant', 'Restaurant', 'Restaurant', 'Malacanang Palace', 'National Museum of the Philippines', 'Intramuros', 'Fort Santiago', 'Paco Park', 'Museo Pambata', 'Manila Zoological and Botanical Garden', 'GT International Tower', 'Pinto Art Museum', 'Casa Santa Museum', 'Ocean/Sea', 'Manila Bay Beach', 'Train', 'Train', 'Subway', 'Subway', 'Ninoy Aquino International Airport', 'Clark International Airport', 'Subic Bay Airport']","['1.2 km', '1.2 km', '1.2 km', '1.2 km', '1.2 km', '1.3 km', '1.4 km', '1.4 km', '1.9 km', '2 km', '350 m', '350 m', '350 m', '2.6 km', '3.8 km', '3.9 km', '3.9 km', '4.2 km', '4.8 km', '6 km', '7 km', '18 km', '20 km', '8 km', '5 km', '500 m', '650 m', '2 km', '2 km', '12 km', '79 km', '81 km']","{'Rosarium Garden': '1.2 km', 'La Loma Cockpit Arena': '1.2 km', 'Quadricentennial Park': '1.2 km', 'Plaza Mayor': '1.2 km', 'Plaza Benavidez': '1.2 km', 'Celadon Park': '1.3 km', 'University Parade Grounds': '1.4 km', 'Norberto S. Amoranto Park': '1.4 km', 'Tan Yan Kee Garden': '1.9 km', 'Freedom Park': '2 km', 'Restaurant': '350 m', 'Malacanang Palace': '2.6 km', 'National Museum of the Philippines': '3.8 km', 'Intramuros': '3.9 km', 'Fort Santiago': '3.9 km', 'Paco Park': '4.2 km', 'Museo Pambata': '4.8 km', 'Manila Zoological and Botanical Garden': '6 km', 'GT International Tower': '7 km', 'Pinto Art Museum': '18 km', 'Casa Santa Museum': '20 km', 'Ocean/Sea': '8 km', 'Manila Bay Beach': '5 km', 'Train': '650 m', 'Subway': '2 km', 'Ninoy Aquino International Airport': '12 km', 'Clark International Airport': '79 km', 'Subic Bay Airport': '81 km'}","['Standard Double Room', 'Standard Double Room', 'Standard Double Room', 'Standard Double Room', 'Deluxe Room', 'Deluxe Room', 'Deluxe Room', 'Deluxe Room']","[907.0, 1205.0, 1299.0, 1732.0, 985.0, 1308.0, 1393.0, 1857.0]",907.0,"['Bathroom', 'Bedroom', 'Media & Technology', 'Parking', 'Safety & security', 'General', 'Languages Spoken']","[['Toilet paper', 'Towels', 'Towels/Sheets (extra fee)', 'Private Bathroom', 'Toilet', 'Free toiletries', 'Shower'], ['Linens'], ['Flat-screen TV', 'Satellite channels', 'TV'], ['Fire extinguishers', 'CCTV outside property', 'CCTV in common areas', 'Smoke alarms', 'Security alarm', '24-hour security'], ['Adults only', 'Air conditioning', 'Non-smoking rooms'], ['English', 'Filipino']]",https://www.booking.com/hotel/ph/reddoorz-piy-margal-sampaloc-manila.html?label=gen173nr-1FCAEoggI46AdIM1gEaLQBiAEBmAEJuAEXyAEM2AEB6AEB-AELiAIBqAIDuALa9-ebBsACAdICJDNiMWUxMTlhLTc3ODEtNGI3NC05MWVlLTQ5MDA0MDQzYzY5NNgCBuACAQ&sid=b3a20c12be6b3d4d9b1b0a71b11d8898&aid=304142&ucfs=1&arphpl=1&checkin=2022-12-01&checkout=2022-12-02&dest_id=-2437894&dest_type=city&group_adults=2&req_adults=2&no_rooms=1&group_children=0&req_children=0&hpos=20&hapos=170&sr_order=popularity&nflt=ht_id%3D204&srpvid=7ca3572c9035002e&srepoch=1669119872&all_sr_blocks=661219101_310854479_0_0_0&highlighted_blocks=661219101_310854479_0_0_0&matching_block_id=661219101_310854479_0_0_0&sr_pri_blocks=661219101_310854479_0_0_0__90717&tpi_r=2&from=searchresults#hotelTmpl
