hotel_name_,stars,location,review_rating,description,main_facilities,total_reviews,sub_ratings,sub_ratings_categories,sub_ratings_dict,hotel_surroundings,hotel_surroundings_distance,surroundings_dict,room_type,price_list,cheapest_price,facilities_groups,all_facilities,link
Herald Suites Polaris - Multiple Use Hotel,3,"45 Polaris St., Bel-Air, Makati, 1209 Manila, Philippines",8.3,"You're eligible for a Genius discount at Herald Suites Polaris - Multiple Use Hotel! To save at this property, all you have to do is  Conveniently located in the Makati district of Manila, Herald Suites Polaris - Multiple Use Hotel is located a 13-minute walk from Power Plant Mall, 1.9 km from Glorietta Mall and a 19-minute walk from Greenbelt Mall. Among the facilities of this property are a restaurant, a 24-hour front desk and room service, along with free WiFi. Guests can have a drink at the snack bar. Guest rooms at the hotel come with air conditioning, a seating area, a flat-screen TV with satellite channels, a safety deposit box and a private bathroom with a bidet, slippers and a hairdryer. All rooms have an electric tea pot, while selected rooms are equipped with a patio and others also offer city views. At Herald Suites Polaris - Multiple Use Hotel each room comes with bed linen and towels. Continental and à la carte breakfast options are available daily at the accommodation. Guests can use the business center or relax in the bar. Bonifacio High Street is 3.9 km from Herald Suites Polaris - Multiple Use Hotel, while Shangri-La Plaza is 4.7 km away. The nearest airport is Ninoy Aquino International, 10.9 km from the hotel, and the property offers a paid airport shuttle service. ","['Airport Shuttle', 'Non Smoking Rooms', 'Room-service', 'Free WiFi Internet Access Included', 'Restaurant', 'Coffee/Tea maker', 'Bar', 'breakfast', 'Airport Shuttle', 'Non Smoking Rooms', 'Room-service', 'Free WiFi Internet Access Included', 'Restaurant', 'Coffee/Tea maker', 'Bar', 'breakfast']",198,"['9.2', '8.3', '8.8', '8.7', '8.6', '8.8', '4.8']","['Staff', 'Facilities', 'Cleanliness', 'Comfort', 'Value for money', 'Location', 'Free WiFi']","{'Staff': '9.2', 'Facilities': '8.3', 'Cleanliness': '8.8', 'Comfort': '8.7', 'Value for money': '8.6', 'Location': '8.8', 'Free WiFi': '4.8'}","['Bel-Air 2 Park', 'General Pio Del Pilar Monument Park', 'Sultan Kudarat Monument Park', 'Bel-Air Park', 'Urdaneta Village Park', 'St. Andrew The Apostle Park', 'Jazz Park', 'Jaime C. Velasquez Park', 'Ninoy Aquino Monument', 'GT International Tower', 'Restaurant', 'Cafe/Bar', 'Restaurant', 'Manila Zoological and Botanical Garden', 'Paco Park', 'Malacanang Palace', 'National Museum of the Philippines', 'Museo Pambata', 'Intramuros', 'Fort Santiago', 'Pinto Art Museum', 'Casa Santa Museum', 'Ocean/Sea', 'Manila Bay Beach', 'Train', 'Train', 'Subway', 'Subway', 'Ninoy Aquino International Airport', 'Subic Bay Airport', 'Clark International Airport']","['250 m', '550 m', '650 m', '700 m', '700 m', '750 m', '750 m', '750 m', '1.1 km', '1.4 km', '30 m', '40 m', '50 m', '4.4 km', '4.8 km', '5 km', '6 km', '6 km', '7 km', '7 km', '15 km', '16 km', '4.9 km', '5 km', '1.1 km', '1.5 km', '4.1 km', '4.8 km', '6 km', '86 km', '86 km']","{'Bel-Air 2 Park': '250 m', 'General Pio Del Pilar Monument Park': '550 m', 'Sultan Kudarat Monument Park': '650 m', 'Bel-Air Park': '700 m', 'Urdaneta Village Park': '700 m', 'St. Andrew The Apostle Park': '750 m', 'Jazz Park': '750 m', 'Jaime C. Velasquez Park': '750 m', 'Ninoy Aquino Monument': '1.1 km', 'GT International Tower': '1.4 km', 'Restaurant': '50 m', 'Cafe/Bar': '40 m', 'Manila Zoological and Botanical Garden': '4.4 km', 'Paco Park': '4.8 km', 'Malacanang Palace': '5 km', 'National Museum of the Philippines': '6 km', 'Museo Pambata': '6 km', 'Intramuros': '7 km', 'Fort Santiago': '7 km', 'Pinto Art Museum': '15 km', 'Casa Santa Museum': '16 km', 'Ocean/Sea': '4.9 km', 'Manila Bay Beach': '5 km', 'Train': '1.5 km', 'Subway': '4.8 km', 'Ninoy Aquino International Airport': '6 km', 'Subic Bay Airport': '86 km', 'Clark International Airport': '86 km'}","['Standard Double Room', 'Standard Double Room', 'Standard Double Room', 'Standard Twin Room', 'Standard Twin Room']","[2260.0, 2550.0, 3600.0, 2550.0, 3600.0]",2260.0,"['Bathroom', 'Bedroom', 'View', 'Outdoors', 'Kitchen', 'Room Amenities', 'Living Area', 'Media & Technology', 'Food & Drink', 'Parking', 'Front Desk Services', 'Cleaning Services', 'Business Facilities', 'Safety & security', 'General', 'Accessibility', 'Spa', 'Languages Spoken']","[['Toilet paper', 'Towels', 'Bidet', 'Bathtub or shower', 'Slippers', 'Private Bathroom', 'Toilet', 'Free toiletries', 'Hairdryer', 'Bathtub', 'Shower'], ['Linens', 'Wardrobe or closet', 'Alarm clock'], ['View'], ['Outdoor furniture'], ['Coffee machine', 'Dryer', 'Electric kettle', 'Refrigerator'], ['Socket near the bed', 'Clothes rack'], ['Sitting area', 'Desk'], ['Flat-screen TV', 'Cable channels', 'Satellite channels', 'Telephone', 'TV'], ['Coffee house on site', 'Fruit', 'Wine/Champagne', ""Kids' meals"", 'Snack bar', 'Bar', 'Minibar', 'Restaurant', 'Tea/Coffee maker'], ['Invoice provided', 'Concierge', 'Baggage storage', 'Currency exchange', '24-hour front desk'], ['Daily housekeeping', 'Suit press', 'Ironing service', 'Dry cleaning', 'Laundry'], ['Fax/Photocopying', 'Business center', 'Meeting/Banquet facilities'], ['Fire extinguishers', 'CCTV outside property', 'CCTV in common areas', 'Smoke alarms', 'Security alarm', 'Key card access', '24-hour security', 'Safe'], ['Shuttle service', 'Convenience store on site', 'Designated smoking area', 'Air conditioning', 'Wake-up service', 'Hardwood or parquet floors', 'Tile/Marble floor', 'Car rental', 'Packed lunches', 'Elevator', 'Facilities for disabled guests', 'Airport shuttle', 'Airport shuttle', 'Airport shuttle', 'Non-smoking rooms', 'Wake-up service/Alarm clock', 'Room service'], ['Entire unit wheelchair accessible', 'Upper floors accessible by stairs only', 'Upper floors accessible by elevator'], ['Full-body massage', 'Massage'], ['English', 'Filipino']]",https://www.booking.com/hotel/ph/herald-suite-polaris.html?label=gen173nr-1FCAEoggI46AdIM1gEaLQBiAEBmAEJuAEXyAEM2AEB6AEB-AELiAIBqAIDuALa9-ebBsACAdICJDNiMWUxMTlhLTc3ODEtNGI3NC05MWVlLTQ5MDA0MDQzYzY5NNgCBuACAQ&sid=b3a20c12be6b3d4d9b1b0a71b11d8898&aid=304142&ucfs=1&arphpl=1&checkin=2022-12-01&checkout=2022-12-02&dest_id=-2437894&dest_type=city&group_adults=2&req_adults=2&no_rooms=1&group_children=0&req_children=0&hpos=22&hapos=172&sr_order=popularity&nflt=ht_id%3D204&srpvid=7ca3572c9035002e&srepoch=1669119872&all_sr_blocks=258118801_0_2_1_0&highlighted_blocks=258118801_0_2_1_0&matching_block_id=258118801_0_2_1_0&sr_pri_blocks=258118801_0_2_1_0__3877&tpi_r=1&from_sustainable_property_sr=1&from=searchresults#hotelTmpl
OYO 431 Apollo 11 Apartelle,3,"1, 38a Apollo 11 San Gregorio Village, Pasay, 1300 Manila, Philippines",7.4,"You're eligible for a Genius discount at OYO 431 Apollo 11 Apartelle! To save at this property, all you have to do is  Located in Manila, 3.1 km from Newport Mall, OYO 431 Apollo 11 Apartelle provides accommodations with free WiFi and free private parking. This 3-star hotel offers room service. The hotel features family rooms. All guest rooms at the hotel are equipped with a seating area. At OYO 431 Apollo 11 Apartelle every room includes air conditioning and a TV. Mall of Asia Arena is 3.1 km from the accommodation, while SMX Convention Center is 3.4 km away. The nearest airport is Ninoy Aquino International Airport, 4 km from OYO 431 Apollo 11 Apartelle. ","['Non Smoking Rooms', 'Room-service', 'Free WiFi Internet Access Included', 'Free Parking', 'Family Rooms', 'Non Smoking Rooms', 'Room-service', 'Free WiFi Internet Access Included', 'Free Parking', 'Family Rooms']",184,"['8.3', '7.2', '7.6', '7.5', '7.8', '6.9', '6.6']","['Staff', 'Facilities', 'Cleanliness', 'Comfort', 'Value for money', 'Location', 'Free WiFi']","{'Staff': '8.3', 'Facilities': '7.2', 'Cleanliness': '7.6', 'Comfort': '7.5', 'Value for money': '7.8', 'Location': '6.9', 'Free WiFi': '6.6'}","['Cockpit', 'Circulo del Mundo', 'Newport Boulevard Roundabout', 'San Felipe Park', 'Magdalena Park', 'Derham Park', 'Pasay City Cockpit', 'Maligayang Pagdating Rotunda', 'SM BY THE BAY NORTH AREA', 'Parade Ground', 'Restaurant', 'Restaurant', 'Restaurant', 'Cafe/Bar', 'Cafe/Bar', 'Cafe/Bar', 'Ninoy Aquino Monument', 'GT International Tower', 'Manila Zoological and Botanical Garden', 'Paco Park', 'Museo Pambata', 'National Museum of the Philippines', 'Malacanang Palace', 'Intramuros', 'Fort Santiago', 'Pinto Art Museum', 'Ocean/Sea', 'Manila Bay Beach', 'Train', 'Subway', 'Train', 'Subway', 'Ninoy Aquino International Airport', 'Subic Bay Airport', 'Clark International Airport']","['1.1 km', '1.4 km', '1.5 km', '1.5 km', '1.6 km', '1.7 km', '2 km', '2.4 km', '2.6 km', '2.9 km', '450 m', '550 m', '550 m', '550 m', '650 m', '650 m', '3.5 km', '3.5 km', '4 km', '6 km', '6 km', '7 km', '7 km', '7 km', '8 km', '18 km', '2.6 km', '4.6 km', '450 m', '650 m', '800 m', '8 km', '2.5 km', '84 km', '87 km']","{'Cockpit': '1.1 km', 'Circulo del Mundo': '1.4 km', 'Newport Boulevard Roundabout': '1.5 km', 'San Felipe Park': '1.5 km', 'Magdalena Park': '1.6 km', 'Derham Park': '1.7 km', 'Pasay City Cockpit': '2 km', 'Maligayang Pagdating Rotunda': '2.4 km', 'SM BY THE BAY NORTH AREA': '2.6 km', 'Parade Ground': '2.9 km', 'Restaurant': '550 m', 'Cafe/Bar': '650 m', 'Ninoy Aquino Monument': '3.5 km', 'GT International Tower': '3.5 km', 'Manila Zoological and Botanical Garden': '4 km', 'Paco Park': '6 km', 'Museo Pambata': '6 km', 'National Museum of the Philippines': '7 km', 'Malacanang Palace': '7 km', 'Intramuros': '7 km', 'Fort Santiago': '8 km', 'Pinto Art Museum': '18 km', 'Ocean/Sea': '2.6 km', 'Manila Bay Beach': '4.6 km', 'Train': '800 m', 'Subway': '8 km', 'Ninoy Aquino International Airport': '2.5 km', 'Subic Bay Airport': '84 km', 'Clark International Airport': '87 km'}","['Deluxe Double Room', 'Deluxe Double Room', 'Deluxe Suite', 'Deluxe Suite', 'Standard Triple', 'Standard Triple', 'Suite Family', 'Suite Family', 'Suite Family', 'Suite Family', 'Standard Single Room', 'Standard Single Room']","[1198.0, 1558.0, 1497.0, 1946.0, 1713.0, 2227.0, 2352.0, 2363.0, 3057.0, 3072.0, 1085.0, 1410.0]",1085.0,"['Living Area', 'Media & Technology', 'Parking', 'Services', 'Safety & security', 'General', 'Languages Spoken']","[['Sitting area'], ['TV'], ['Accessible parking'], ['Daily housekeeping', 'Room service'], ['Fire extinguishers', 'CCTV in common areas', 'Smoke alarms', 'Key access'], ['Air conditioning', 'Fan', 'Family rooms', 'Non-smoking rooms'], ['English', 'Filipino']]",https://www.booking.com/hotel/ph/oyo-431-apollo-11-apartelle.html?label=gen173nr-1FCAEoggI46AdIM1gEaLQBiAEBmAEJuAEXyAEM2AEB6AEB-AELiAIBqAIDuALa9-ebBsACAdICJDNiMWUxMTlhLTc3ODEtNGI3NC05MWVlLTQ5MDA0MDQzYzY5NNgCBuACAQ&sid=b3a20c12be6b3d4d9b1b0a71b11d8898&aid=304142&ucfs=1&arphpl=1&checkin=2022-12-01&checkout=2022-12-02&dest_id=-2437894&dest_type=city&group_adults=2&req_adults=2&no_rooms=1&group_children=0&req_children=0&hpos=23&hapos=173&sr_order=popularity&nflt=ht_id%3D204&srpvid=7ca3572c9035002e&srepoch=1669119872&all_sr_blocks=601577703_0_2_0_0&highlighted_blocks=601577703_0_2_0_0&matching_block_id=601577703_0_2_0_0&sr_pri_blocks=601577703_0_2_0_0__1797&tpi_r=1&from=searchresults#hotelTmpl
Herald Suites - Multiple Use Hotel,3,"2168 Don Chino Roces Avenue, Makati, 1231 Manila, Philippines",8.1,"Located in the financial district of Makati, Herald Suites is 0.6 mi from the Ayala and Greenbelt Commercial Center. Hotel features 3 dining options and free Wi-Fi. Ninoy Aquino Airport is a 20-minute drive from Herald Suites. Airport shuttle service is offered. Little Tokyo and Rockwell Complex are a few blocks from the hotel. Rooms are equipped with IDD telephone lines, tea/coffer maker and cable television. There is also a mini-bar and a private bathroom. Herald Suites has a business center and a meeting room. Laundry and dry cleaning services are available. Coca Café serves sandwiches and salads and the Hatsu Hana Tei Japanese Restaurant features Japanese dishes. ","['Swimming pool', 'Airport Shuttle', 'Non Smoking Rooms', 'Room-service', 'Restaurant', 'Rooms/Facilities for Disabled', 'Free WiFi Internet Access Included', 'Coffee/Tea maker', 'Bar', 'breakfast', 'Swimming pool', 'Airport Shuttle', 'Non Smoking Rooms', 'Room-service', 'Restaurant', 'Rooms/Facilities for Disabled', 'Free WiFi Internet Access Included', 'Coffee/Tea maker', 'Bar', 'breakfast']",163,"['9.1', '8.1', '8.4', '8.3', '8.2', '8.4', '7.5']","['Staff', 'Facilities', 'Cleanliness', 'Comfort', 'Value for money', 'Location', 'Free WiFi']","{'Staff': '9.1', 'Facilities': '8.1', 'Cleanliness': '8.4', 'Comfort': '8.3', 'Value for money': '8.2', 'Location': '8.4', 'Free WiFi': '7.5'}","['Legazpi Active Park', 'GT International Tower', 'Ninoy Aquino Monument', 'Pasay City Cockpit', 'Jaime C. Velasquez Park', 'Palm Promenade Park', 'Sultan Kudarat Monument Park', 'General Pio Del Pilar Monument Park', 'Jazz Park', 'Urdaneta Village Park', 'Restaurant', 'Cafe/Bar', 'Restaurant', 'Restaurant', 'Cafe/Bar', 'Cafe/Bar', 'Manila Zoological and Botanical Garden', 'Paco Park', 'Museo Pambata', 'Malacanang Palace', 'National Museum of the Philippines', 'Intramuros', 'Fort Santiago', 'Pinto Art Museum', 'Casa Santa Museum', 'Ocean/Sea', 'Manila Bay Beach', 'Train', 'Train', 'Subway', 'Subway', 'Ninoy Aquino International Airport', 'Subic Bay Airport', 'Clark International Airport']","['350 m', '750 m', '900 m', '1.1 km', '1.2 km', '1.2 km', '1.4 km', '1.5 km', '1.6 km', '1.7 km', '10 m', '10 m', '30 m', '40 m', '50 m', '50 m', '3 km', '4.1 km', '4.8 km', '5 km', '5 km', '6 km', '7 km', '17 km', '18 km', '3.1 km', '3.8 km', '450 m', '600 m', '2.2 km', '5 km', '4.6 km', '84 km', '86 km']","{'Legazpi Active Park': '350 m', 'GT International Tower': '750 m', 'Ninoy Aquino Monument': '900 m', 'Pasay City Cockpit': '1.1 km', 'Jaime C. Velasquez Park': '1.2 km', 'Palm Promenade Park': '1.2 km', 'Sultan Kudarat Monument Park': '1.4 km', 'General Pio Del Pilar Monument Park': '1.5 km', 'Jazz Park': '1.6 km', 'Urdaneta Village Park': '1.7 km', 'Restaurant': '40 m', 'Cafe/Bar': '50 m', 'Manila Zoological and Botanical Garden': '3 km', 'Paco Park': '4.1 km', 'Museo Pambata': '4.8 km', 'Malacanang Palace': '5 km', 'National Museum of the Philippines': '5 km', 'Intramuros': '6 km', 'Fort Santiago': '7 km', 'Pinto Art Museum': '17 km', 'Casa Santa Museum': '18 km', 'Ocean/Sea': '3.1 km', 'Manila Bay Beach': '3.8 km', 'Train': '600 m', 'Subway': '5 km', 'Ninoy Aquino International Airport': '4.6 km', 'Subic Bay Airport': '84 km', 'Clark International Airport': '86 km'}","['Standard Double or Twin Room', 'Standard Double or Twin Room', 'Superior King Room']","[3646.0, 8000.0, 4320.0]",3646.0,"['Bathroom', 'Bedroom', 'View', 'Outdoors', 'Kitchen', 'Room Amenities', 'Living Area', 'Media & Technology', 'Food & Drink', 'Parking', 'Front Desk Services', 'Cleaning Services', 'Business Facilities', 'Safety & security', 'General', 'Accessibility', 'Outdoor swimming pool', 'Spa', 'Languages Spoken']","[['Toilet paper', 'Towels', 'Bidet', 'Bathtub or shower', 'Slippers', 'Private Bathroom', 'Toilet', 'Free toiletries', 'Hairdryer', 'Bathtub', 'Shower'], ['Linens', 'Wardrobe or closet', 'Alarm clock'], ['City view', 'View'], ['Garden'], ['Coffee machine', 'Cleaning products', 'Electric kettle', 'Refrigerator'], ['Socket near the bed', 'Clothes rack'], ['Sitting area', 'Desk'], ['Flat-screen TV', 'Cable channels', 'Telephone', 'TV'], ['Coffee house on site', 'Bar', 'Minibar', 'Restaurant', 'Tea/Coffee maker'], ['Invoice provided', 'Concierge', 'Baggage storage', 'Currency exchange', '24-hour front desk'], ['Daily housekeeping', 'Suit press', 'Ironing service', 'Dry cleaning', 'Laundry'], ['Fax/Photocopying', 'Business center', 'Meeting/Banquet facilities'], ['Fire extinguishers', 'CCTV outside property', 'CCTV in common areas', 'Smoke alarms', 'Security alarm', 'Key card access', 'Key access', '24-hour security', 'Safe'], ['Shuttle service', 'Shared lounge/TV area', 'Designated smoking area', 'Air conditioning', 'Wake-up service', 'Hardwood or parquet floors', 'Car rental', 'Packed lunches', 'Elevator', 'Family rooms', 'Ironing facilities', 'Facilities for disabled guests', 'Airport shuttle', 'Airport shuttle', 'Airport shuttle', 'Non-smoking rooms', 'Iron', 'Wake-up service/Alarm clock', 'Room service'], ['Upper floors accessible by stairs only', 'Upper floors accessible by elevator'], ['Pool with view', 'Pool/Beach towels', 'Beach chairs/Loungers', 'Fenced pool'], ['Full-body massage', 'Beach chairs/Loungers', 'Massage'], ['English', 'Japanese', 'Filipino']]",https://www.booking.com/hotel/ph/herald-suites.html?label=gen173nr-1FCAEoggI46AdIM1gEaLQBiAEBmAEJuAEXyAEM2AEB6AEB-AELiAIBqAIDuALa9-ebBsACAdICJDNiMWUxMTlhLTc3ODEtNGI3NC05MWVlLTQ5MDA0MDQzYzY5NNgCBuACAQ&sid=b3a20c12be6b3d4d9b1b0a71b11d8898&aid=304142&ucfs=1&arphpl=1&checkin=2022-12-01&checkout=2022-12-02&dest_id=-2437894&dest_type=city&group_adults=2&req_adults=2&no_rooms=1&group_children=0&req_children=0&hpos=2&hapos=177&sr_order=popularity&nflt=ht_id%3D204&srpvid=7ca3572c9035002e&srepoch=1669119877&all_sr_blocks=25888401_347539021_2_1_0&highlighted_blocks=25888401_347539021_2_1_0&matching_block_id=25888401_347539021_2_1_0&sr_pri_blocks=25888401_347539021_2_1_0__336600&from=searchresults#hotelTmpl
RedDoorz The Providence Tower - Vaccinated Staff,2,"The Providence Tower Manila, Leon Guinto Street, Corner Estrada St., 1004 Manila, Philippines",6.9,"Located within 1.9 km of Manila Bay Beach and 2.6 km of World Trade Center Metro Manila, RedDoorz The Providence Tower - Vaccinated Staff has rooms with air conditioning and a private bathroom in Manila. The property is around 3.7 km from Rizal Park, 4.2 km from Intramuros and 4.5 km from Greenbelt Mall. The property is 5.1 km from SM by the Bay Amusement Park and 5.1 km from Mall of Asia Arena. The rooms in the hotel are equipped with a TV. At RedDoorz The Providence Tower - Vaccinated Staff the rooms include bed linen and towels. Guests at the accommodation can enjoy a à la carte or an Asian breakfast. Glorietta Mall is 5 km from RedDoorz The Providence Tower - Vaccinated Staff, while Manila Cathedral is 5.1 km from the property. The nearest airport is Ninoy Aquino International Airport, 8 km from the hotel. ","['Non Smoking Rooms', 'Fitness Room', 'Free WiFi Internet Access Included', 'Laundry', 'Elevator', 'breakfast', 'Non Smoking Rooms', 'Fitness Room', 'Free WiFi Internet Access Included', 'Laundry', 'Elevator', 'breakfast']",20,"['7.9', '6.7', '7.2', '7.1', '7.2', '8.0', '9.2']","['Staff', 'Facilities', 'Cleanliness', 'Comfort', 'Value for money', 'Location', 'Free WiFi']","{'Staff': '7.9', 'Facilities': '6.7', 'Cleanliness': '7.2', 'Comfort': '7.1', 'Value for money': '7.2', 'Location': '8.0', 'Free WiFi': '9.2'}","['Marian Quadrangle', 'Amphitheater', ""MMDA Children's Road Safety Park"", 'Manila Zoological and Botanical Garden', 'Remedios Circle', 'ASEAN Garden', 'Rajah Sulayman Park', 'Manila Baywalk', 'Pedro Gil Park', 'Plaza Dilao', 'Restaurant', 'Restaurant', 'Restaurant', 'Paco Park', 'GT International Tower', 'Museo Pambata', 'National Museum of the Philippines', 'Ninoy Aquino Monument', 'Malacanang Palace', 'Intramuros', 'Fort Santiago', 'Pinto Art Museum', 'Casa Santa Museum', 'Ocean/Sea', 'Manila Bay Beach', 'Train', 'Train', 'Subway', 'Subway', 'Ninoy Aquino International Airport', 'Subic Bay Airport', 'Clark International Airport']","['200 m', '200 m', '700 m', '700 m', '1.1 km', '1.1 km', '1.3 km', '1.5 km', '1.8 km', '1.8 km', '20 m', '20 m', '30 m', '2 km', '2.4 km', '2.5 km', '2.9 km', '3 km', '3.3 km', '3.5 km', '4.2 km', '18 km', '20 km', '2 km', '1.4 km', '150 m', '700 m', '3.1 km', '4 km', '6 km', '82 km', '84 km']","{'Marian Quadrangle': '200 m', 'Amphitheater': '200 m', ""MMDA Children's Road Safety Park"": '700 m', 'Manila Zoological and Botanical Garden': '700 m', 'Remedios Circle': '1.1 km', 'ASEAN Garden': '1.1 km', 'Rajah Sulayman Park': '1.3 km', 'Manila Baywalk': '1.5 km', 'Pedro Gil Park': '1.8 km', 'Plaza Dilao': '1.8 km', 'Restaurant': '30 m', 'Paco Park': '2 km', 'GT International Tower': '2.4 km', 'Museo Pambata': '2.5 km', 'National Museum of the Philippines': '2.9 km', 'Ninoy Aquino Monument': '3 km', 'Malacanang Palace': '3.3 km', 'Intramuros': '3.5 km', 'Fort Santiago': '4.2 km', 'Pinto Art Museum': '18 km', 'Casa Santa Museum': '20 km', 'Ocean/Sea': '2 km', 'Manila Bay Beach': '1.4 km', 'Train': '700 m', 'Subway': '4 km', 'Ninoy Aquino International Airport': '6 km', 'Subic Bay Airport': '82 km', 'Clark International Airport': '84 km'}","['Standard Double Room', 'Standard Double Room', 'Standard Double Room', 'Standard Double Room', 'Deluxe Room', 'Deluxe Room', 'Deluxe Room', 'Deluxe Room', 'Executive Suite', 'Executive Suite', 'Executive Suite', 'Queen Room', 'Queen Room', 'Queen Room', 'Queen Room']","[1074.0, 1392.0, 2784.0, 2984.0, 1560.0, 2075.0, 2145.0, 2283.0, 1560.0, 3120.0, 3320.0, 1813.0, 2392.0, 2493.0, 2631.0]",1074.0,"['Bathroom', 'Bedroom', 'Media & Technology', 'Parking', 'Services', 'Safety & security', 'General', 'Accessibility', 'Spa', 'Languages Spoken']","[['Toilet paper', 'Towels', 'Towels/Sheets (extra fee)', 'Private Bathroom', 'Toilet', 'Free toiletries', 'Shower'], ['Linens'], ['TV'], ['Laundry', 'Meeting/Banquet facilities'], ['Fire extinguishers', 'CCTV in common areas', 'Smoke alarms', 'Security alarm', 'Key access', '24-hour security'], ['Adults only', 'Designated smoking area', 'Air conditioning', 'Elevator', 'Non-smoking rooms'], ['Upper floors accessible by elevator'], ['Fitness center'], ['English', 'Filipino']]",https://www.booking.com/hotel/ph/reddoorz-the-providence-tower.html?label=gen173nr-1FCAEoggI46AdIM1gEaLQBiAEBmAEJuAEXyAEM2AEB6AEB-AELiAIBqAIDuALa9-ebBsACAdICJDNiMWUxMTlhLTc3ODEtNGI3NC05MWVlLTQ5MDA0MDQzYzY5NNgCBuACAQ&sid=b3a20c12be6b3d4d9b1b0a71b11d8898&aid=304142&ucfs=1&arphpl=1&checkin=2022-12-01&checkout=2022-12-02&dest_id=-2437894&dest_type=city&group_adults=2&req_adults=2&no_rooms=1&group_children=0&req_children=0&hpos=3&hapos=178&sr_order=popularity&nflt=ht_id%3D204&srpvid=7ca3572c9035002e&srepoch=1669119877&all_sr_blocks=688361103_310854106_0_0_0&highlighted_blocks=688361103_310854106_0_0_0&matching_block_id=688361103_310854106_0_0_0&sr_pri_blocks=688361103_310854106_0_0_0__135005&from=searchresults#hotelTmpl
