hotel_name_,stars,location,review_rating,description,main_facilities,total_reviews,sub_ratings,sub_ratings_categories,sub_ratings_dict,hotel_surroundings,hotel_surroundings_distance,surroundings_dict,room_type,price_list,cheapest_price,facilities_groups,all_facilities,link
Wynwood Hotel - Multiple Use Hotel,4,"45 San Miguel Avenue, Ortigas Center, Pasig, 1605 Manila, Philippines",8.6,"Boasting a fitness center, bar and views of city, Wynwood Hotel is located in Manila, 0.9 mi from SM Megamall. Among the facilities of this property are a restaurant, a 24-hour front desk and room service, along with free WiFi throughout the property. The hotel has newspapers and an ATM machine that guests can use. The rooms are fitted with air conditioning, a flat-screen TV with cable channels, a kettle, a bidet, free toiletries and a desk. At the hotel rooms are fitted with a wardrobe and a private bathroom. A continental breakfast is available each morning at Wynwood Hotel. The accommodations offers a terrace. Shangri-La Plaza is 0.9 mi from Wynwood Hotel, while Power Plant Mall is 3.1 mi from the property. The nearest airport is Manila Ninoy Aquino International, 8.1 mi from the hotel, and the property offers a paid airport shuttle service. ","['Airport Shuttle', 'Non Smoking Rooms', 'Room-service', 'Free Parking', 'Restaurant', 'Coffee/Tea maker', 'Bar', 'breakfast', 'Airport Shuttle', 'Non Smoking Rooms', 'Room-service', 'Free Parking', 'Restaurant', 'Coffee/Tea maker', 'Bar', 'breakfast']",39,"['9.1', '8.6', '9.1', '9.1', '8.9', '9.0', '8.3']","['Staff', 'Facilities', 'Cleanliness', 'Comfort', 'Value for money', 'Location', 'Free WiFi']","{'Staff': '9.1', 'Facilities': '8.6', 'Cleanliness': '9.1', 'Comfort': '9.1', 'Value for money': '8.9', 'Location': '9.0', 'Free WiFi': '8.3'}","['Ortigas Park', 'Greenfield Central Park', 'Capitol Commons Park', 'Garden Park 6', 'Kapitolyo Park', 'CGS Community Park', ""Lineman's Training Camp"", 'Tennis Courts', 'Football Field', 'Makati Park', 'Restaurant', 'Restaurant', 'Restaurant', 'Ninoy Aquino Monument', 'GT International Tower', 'Malacanang Palace', 'Manila Zoological and Botanical Garden', 'National Museum of the Philippines', 'Museo Pambata', 'Intramuros', 'Fort Santiago', 'Pinto Art Museum', 'Casa Santa Museum', 'Ocean/Sea', 'Manila Bay Beach', 'Train', 'Train', 'Subway', 'Subway', 'Ninoy Aquino International Airport', 'Clark International Airport', 'Subic Bay Airport']","['550 m', '750 m', '800 m', '1.2 km', '1.2 km', '1.4 km', '1.5 km', '1.5 km', '1.5 km', '2 km', '100 m', '100 m', '100 m', '5 km', '5 km', '7 km', '8 km', '9 km', '9 km', '9 km', '10 km', '11 km', '13 km', '9 km', '9 km', '750 m', '750 m', '4.5 km', '4.5 km', '9 km', '86 km', '88 km']","{'Ortigas Park': '550 m', 'Greenfield Central Park': '750 m', 'Capitol Commons Park': '800 m', 'Garden Park 6': '1.2 km', 'Kapitolyo Park': '1.2 km', 'CGS Community Park': '1.4 km', ""Lineman's Training Camp"": '1.5 km', 'Tennis Courts': '1.5 km', 'Football Field': '1.5 km', 'Makati Park': '2 km', 'Restaurant': '100 m', 'Ninoy Aquino Monument': '5 km', 'GT International Tower': '5 km', 'Malacanang Palace': '7 km', 'Manila Zoological and Botanical Garden': '8 km', 'National Museum of the Philippines': '9 km', 'Museo Pambata': '9 km', 'Intramuros': '9 km', 'Fort Santiago': '10 km', 'Pinto Art Museum': '11 km', 'Casa Santa Museum': '13 km', 'Ocean/Sea': '9 km', 'Manila Bay Beach': '9 km', 'Train': '750 m', 'Subway': '4.5 km', 'Ninoy Aquino International Airport': '9 km', 'Clark International Airport': '86 km', 'Subic Bay Airport': '88 km'}","['Standard Queen Room', 'Standard Queen Room', 'Superior King Room', 'Superior King Room', 'Superior Queen Room', 'Superior Queen Room', 'Superior Twin Room', 'Superior Twin Room', 'Deluxe King Room', 'Deluxe King Room', 'Deluxe Twin Room', 'Deluxe Twin Room']","[3373.0, 2998.0, 3523.0, 3148.0, 3523.0, 3148.0, 3523.0, 3148.0, 3673.0, 3298.0, 3673.0, 3298.0]",2998.0,"['Bathroom', 'Bedroom', 'Kitchen', 'Room Amenities', 'Living Area', 'Media & Technology', 'Food & Drink', 'Parking', 'Front Desk Services', 'Cleaning Services', 'Business Facilities', 'Safety & security', 'General', 'Accessibility', 'Spa', 'Languages Spoken']","[['Toilet paper', 'Bidet', 'Guest bathroom', 'Private Bathroom', 'Toilet', 'Free toiletries', 'Bathrobe', 'Shower'], ['Wardrobe or closet'], ['Electric kettle'], ['Clothes rack'], ['Desk'], ['Flat-screen TV', 'Cable channels', 'Telephone', 'TV'], ['Special diet meals (on request)', 'Breakfast in the room', 'Bar', 'Minibar', 'Restaurant', 'Tea/Coffee maker'], ['Parking garage', 'Accessible parking'], ['Concierge', 'ATM on site', 'Baggage storage', 'Currency exchange', '24-hour front desk'], ['Daily housekeeping', 'Suit press', 'Ironing service', 'Dry cleaning', 'Laundry'], ['Fax/Photocopying', 'Meeting/Banquet facilities'], ['CCTV outside property', 'CCTV in common areas', 'Smoke alarms', 'Security alarm', 'Key card access', '24-hour security', 'Safe'], ['Shuttle service', 'Designated smoking area', 'Air conditioning', 'Smoke-free property', 'Soundproof', 'Car rental', 'Elevator', 'Facilities for disabled guests', 'Airport shuttle', 'Airport shuttle', 'Airport shuttle', 'Non-smoking rooms', 'Room service'], ['Toilet with grab rails', 'Entire unit wheelchair accessible', 'Upper floors accessible by elevator'], ['Fitness'], ['English', 'Filipino']]",https://www.booking.com/hotel/ph/wynwood-hotel.html?label=gen173nr-1FCAEoggI46AdIM1gEaLQBiAEBmAEJuAEXyAEM2AEB6AEB-AELiAIBqAIDuALa9-ebBsACAdICJDNiMWUxMTlhLTc3ODEtNGI3NC05MWVlLTQ5MDA0MDQzYzY5NNgCBuACAQ&sid=b3a20c12be6b3d4d9b1b0a71b11d8898&aid=304142&ucfs=1&arphpl=1&checkin=2022-12-01&checkout=2022-12-02&dest_id=-2437894&dest_type=city&group_adults=2&req_adults=2&no_rooms=1&group_children=0&req_children=0&hpos=15&hapos=190&sr_order=popularity&nflt=ht_id%3D204&srpvid=7ca3572c9035002e&srepoch=1669119877&all_sr_blocks=193957107_266352891_2_1_0&highlighted_blocks=193957107_266352891_2_1_0&matching_block_id=193957107_266352891_2_1_0&sr_pri_blocks=193957107_266352891_2_1_0__342770&from=searchresults#hotelTmpl
Eurotel Makati,3,"Chino Roces Corner Arnaiz Avenue, Makati, 1230 Manila, Philippines",5.4,"Situated in Makati’s central business district, Eurotel features a restaurant and air-conditioned rooms with flat-screen TV. It offers massage service and free Wi-Fi and on-site parking. All guest rooms are equipped with a work desk and a private bathroom with amenities. Guests of Eurotel can also enjoy in-room breakfast. Eurotel Makati features a business center and can organize banquets and meetings. Hotel Eurotel Makati is less than 9.7 km from Ninoy Aquino Airport, and less than 4.8 km from SM Mall of Asia and Manila’s baywalk area. ","['Non Smoking Rooms', 'Room-service', 'Free WiFi Internet Access Included', 'Free Parking', '24 hour Front Desk', 'breakfast', 'Non Smoking Rooms', 'Room-service', 'Free WiFi Internet Access Included', 'Free Parking', '24 hour Front Desk', 'breakfast']",390,"['6.8', '5.5', '5.9', '5.8', '6.1', '7.6', '5.3']","['Staff', 'Facilities', 'Cleanliness', 'Comfort', 'Value for money', 'Location', 'Free WiFi']","{'Staff': '6.8', 'Facilities': '5.5', 'Cleanliness': '5.9', 'Comfort': '5.8', 'Value for money': '6.1', 'Location': '7.6', 'Free WiFi': '5.3'}","['Legazpi Active Park', 'Pasay City Cockpit', 'GT International Tower', 'Ninoy Aquino Monument', 'Palm Promenade Park', 'Jaime C. Velasquez Park', 'Sultan Kudarat Monument Park', 'General Pio Del Pilar Monument Park', 'San Felipe Park', 'Jazz Park', 'Restaurant', 'Cafe/Bar', 'Restaurant', 'Manila Zoological and Botanical Garden', 'Paco Park', 'Museo Pambata', 'Malacanang Palace', 'National Museum of the Philippines', 'Intramuros', 'Fort Santiago', 'Pinto Art Museum', 'Casa Santa Museum', 'Ocean/Sea', 'Manila Bay Beach', 'Train', 'Train', 'Subway', 'Subway', 'Ninoy Aquino International Airport', 'Subic Bay Airport', 'Clark International Airport']","['450 m', '1,000 m', '1,000 m', '1 km', '1.2 km', '1.4 km', '1.5 km', '1.6 km', '1.7 km', '1.7 km', '30 m', '50 m', '50 m', '3.1 km', '4.2 km', '5 km', '5 km', '5 km', '6 km', '7 km', '17 km', '18 km', '3 km', '3.9 km', '250 m', '750 m', '2 km', '6 km', '4.4 km', '84 km', '86 km']","{'Legazpi Active Park': '450 m', 'Pasay City Cockpit': '1,000 m', 'GT International Tower': '1,000 m', 'Ninoy Aquino Monument': '1 km', 'Palm Promenade Park': '1.2 km', 'Jaime C. Velasquez Park': '1.4 km', 'Sultan Kudarat Monument Park': '1.5 km', 'General Pio Del Pilar Monument Park': '1.6 km', 'San Felipe Park': '1.7 km', 'Jazz Park': '1.7 km', 'Restaurant': '50 m', 'Cafe/Bar': '50 m', 'Manila Zoological and Botanical Garden': '3.1 km', 'Paco Park': '4.2 km', 'Museo Pambata': '5 km', 'Malacanang Palace': '5 km', 'National Museum of the Philippines': '5 km', 'Intramuros': '6 km', 'Fort Santiago': '7 km', 'Pinto Art Museum': '17 km', 'Casa Santa Museum': '18 km', 'Ocean/Sea': '3 km', 'Manila Bay Beach': '3.9 km', 'Train': '750 m', 'Subway': '6 km', 'Ninoy Aquino International Airport': '4.4 km', 'Subic Bay Airport': '84 km', 'Clark International Airport': '86 km'}","['Studio', 'Studio', 'Standard Double Room', 'Standard Double Room', 'Standard Twin Room', 'Standard Twin Room', 'Suite', 'Suite', 'Twin Suite', 'Twin Suite', 'Family Suite', 'Family Suite']","[1396.0, 2071.0, 1640.0, 2316.0, 1640.0, 2316.0, 1952.0, 2681.0, 1952.0, 2681.0, 2928.0, 4023.0]",1396.0,"['Bathroom', 'Bedroom', 'Living Area', 'Media & Technology', 'Food & Drink', 'Parking', 'Services', 'Safety & security', 'General', 'Accessibility', 'Languages Spoken']","[['Toilet paper', 'Towels', 'Bidet', 'Slippers', 'Private Bathroom', 'Toilet', 'Free toiletries', 'Hairdryer', 'Shower'], ['Linens'], ['Desk'], ['Flat-screen TV', 'Satellite channels', 'Telephone', 'TV'], ['Coffee house on site'], ['Secure parking', 'Parking garage', 'Accessible parking'], ['Daily housekeeping', 'Concierge', 'Baggage storage', 'Wake-up service', 'Fax/Photocopying', 'Car rental', '24-hour front desk', 'Meeting/Banquet facilities', 'Room service'], ['CCTV outside property', 'CCTV in common areas', 'Smoke alarms', 'Security alarm', 'Key card access', '24-hour security', 'Safe'], ['Designated smoking area', 'Air conditioning', 'Elevator', 'Non-smoking rooms'], ['Upper floors accessible by elevator'], ['English', 'Filipino']]",https://www.booking.com/hotel/ph/eurotel-makati.html?label=gen173nr-1FCAEoggI46AdIM1gEaLQBiAEBmAEJuAEXyAEM2AEB6AEB-AELiAIBqAIDuALa9-ebBsACAdICJDNiMWUxMTlhLTc3ODEtNGI3NC05MWVlLTQ5MDA0MDQzYzY5NNgCBuACAQ&sid=b3a20c12be6b3d4d9b1b0a71b11d8898&aid=304142&ucfs=1&arphpl=1&checkin=2022-12-01&checkout=2022-12-02&dest_id=-2437894&dest_type=city&group_adults=2&req_adults=2&no_rooms=1&group_children=0&req_children=0&hpos=17&hapos=192&sr_order=popularity&nflt=ht_id%3D204&srpvid=7ca3572c9035002e&srepoch=1669119877&all_sr_blocks=24566706_265554942_0_2_0&highlighted_blocks=24566706_265554942_0_2_0&matching_block_id=24566706_265554942_0_2_0&sr_pri_blocks=24566706_265554942_0_2_0__137366&from=searchresults#hotelTmpl
OYO 406 Royal Parc Inn & Suites,3,"#49 Annapolis Street, Cubao, Quezon City, 1109 Manila, Philippines",7.7,"You're eligible for a Genius discount at OYO 406 Royal Parc Inn & Suites! To save at this property, all you have to do is  OYO 406 Royal Parc Inn & Suites features air-conditioned rooms with TV in the Quezon City district of Manila. Among the facilities at this property are a 24-hour front desk and room service, along with free WiFi throughout the property. The property is 6.6 km from SM Megamall and 8.2 km from Malacanang Palace. Smart Araneta Coliseum is a 9-minute walk from the hotel, while Shangri-La Plaza is 6.3 km from the property. The nearest airport is Ninoy Aquino International Airport, 19.3 km from OYO 406 Royal Parc Inn & Suites. ","['Non Smoking Rooms', 'Room-service', 'Free WiFi Internet Access Included', 'Free Parking', '24 hour Front Desk', 'Non Smoking Rooms', 'Room-service', 'Free WiFi Internet Access Included', 'Free Parking', '24 hour Front Desk']",467,"['8.3', '7.5', '8.0', '8.0', '8.3', '8.1', '8.3']","['Staff', 'Facilities', 'Cleanliness', 'Comfort', 'Value for money', 'Location', 'Free WiFi']","{'Staff': '8.3', 'Facilities': '7.5', 'Cleanliness': '8.0', 'Comfort': '8.0', 'Value for money': '8.3', 'Location': '8.1', 'Free WiFi': '8.3'}","['San Martin de Porres Barangay Covered Court', 'Garden', 'Barangay Bagumbuhay Wildlife Center', 'Plaza Bugallon Oval', 'Robinsons Magnolia Park', 'Camerino Park', 'Barangay Mariana Park', 'Quezon City Hall Park and Lagoon', ""Children's Park"", 'Hardin ng Rosas Bird Watching Site', 'Restaurant', 'Restaurant', 'Restaurant', 'Quezon Memorial Circle', 'Malacanang Palace', 'GT International Tower', 'National Museum of the Philippines', 'Intramuros', 'Fort Santiago', 'Museo Pambata', 'Manila Zoological and Botanical Garden', 'Pinto Art Museum', 'Casa Santa Museum', 'Ocean/Sea', 'Manila Bay Beach', 'Train', 'Subway', 'Train', 'Subway', 'Ninoy Aquino International Airport', 'Clark International Airport', 'Subic Bay Airport']","['1.1 km', '1.3 km', '1.6 km', '1.7 km', '1.9 km', '2 km', '2.4 km', '2.4 km', '2.4 km', '2.6 km', '250 m', '250 m', '300 m', '2.8 km', '7 km', '8 km', '9 km', '9 km', '9 km', '10 km', '10 km', '13 km', '14 km', '11 km', '10 km', '800 m', '1.2 km', '1.2 km', '1.6 km', '13 km', '82 km', '86 km']","{'San Martin de Porres Barangay Covered Court': '1.1 km', 'Garden': '1.3 km', 'Barangay Bagumbuhay Wildlife Center': '1.6 km', 'Plaza Bugallon Oval': '1.7 km', 'Robinsons Magnolia Park': '1.9 km', 'Camerino Park': '2 km', 'Barangay Mariana Park': '2.4 km', 'Quezon City Hall Park and Lagoon': '2.4 km', ""Children's Park"": '2.4 km', 'Hardin ng Rosas Bird Watching Site': '2.6 km', 'Restaurant': '300 m', 'Quezon Memorial Circle': '2.8 km', 'Malacanang Palace': '7 km', 'GT International Tower': '8 km', 'National Museum of the Philippines': '9 km', 'Intramuros': '9 km', 'Fort Santiago': '9 km', 'Museo Pambata': '10 km', 'Manila Zoological and Botanical Garden': '10 km', 'Pinto Art Museum': '13 km', 'Casa Santa Museum': '14 km', 'Ocean/Sea': '11 km', 'Manila Bay Beach': '10 km', 'Train': '1.2 km', 'Subway': '1.6 km', 'Ninoy Aquino International Airport': '13 km', 'Clark International Airport': '82 km', 'Subic Bay Airport': '86 km'}","['Deluxe Double Room', 'Standard Double Room', 'Standard Double Room', 'Deluxe Double Room', 'Deluxe Double Room', 'Deluxe Twin Room', 'Deluxe Twin Room']","[810.0, 962.0, 1251.0, 962.0, 1251.0, 962.0, 1251.0]",810.0,"['Media & Technology', 'Parking', 'Services', 'Safety & security', 'General', 'Languages Spoken']","[['Telephone', 'TV'], ['Secure parking'], ['Daily housekeeping', 'Concierge', 'Baggage storage', '24-hour front desk', 'Room service'], ['Fire extinguishers', 'CCTV outside property', 'CCTV in common areas', 'Smoke alarms', 'Security alarm'], ['Air conditioning', 'Fan', 'Non-smoking rooms'], ['English', 'Filipino']]",https://www.booking.com/hotel/ph/royale-parc-inn-amp-suites.html?label=gen173nr-1FCAEoggI46AdIM1gEaLQBiAEBmAEJuAEXyAEM2AEB6AEB-AELiAIBqAIDuALa9-ebBsACAdICJDNiMWUxMTlhLTc3ODEtNGI3NC05MWVlLTQ5MDA0MDQzYzY5NNgCBuACAQ&sid=b3a20c12be6b3d4d9b1b0a71b11d8898&aid=304142&ucfs=1&arphpl=1&checkin=2022-12-01&checkout=2022-12-02&dest_id=-2437894&dest_type=city&group_adults=2&req_adults=2&no_rooms=1&group_children=0&req_children=0&hpos=21&hapos=196&sr_order=popularity&nflt=ht_id%3D204&srpvid=7ca3572c9035002e&srepoch=1669119877&all_sr_blocks=301074604_357534421_2_0_0&highlighted_blocks=301074604_357534421_2_0_0&matching_block_id=301074604_357534421_2_0_0&sr_pri_blocks=301074604_357534421_2_0_0__96227&from=searchresults#hotelTmpl
RedDoorz Plus near Bamboo Organ Las Piñas,3,"Padre Cierra Avenue Pulang Lupa, Las Pinas City, Las Pinas, 1742 Manila, Philippines",7.8,"You're eligible for a Genius discount at RedDoorz Plus near Bamboo Organ Las Piñas! To save at this property, all you have to do is  RedDoorz Plus near RedDoorz Plus near Bamboo Organ Las Piñas features air-conditioned rooms with satellite flat-screen TV in the Las Pinas district of Manila. The property is around 5 mi from City of Dreams Manila, 6.2 mi from SMX Convention Center and 6.2 mi from SM Mall of Asia. The hotel features family rooms. Featuring a private bathroom with a shower and free toiletries, rooms at the hotel also offer free WiFi. Mall of Asia Arena is 6.2 mi from RedDoorz Plus near RedDoorz Plus near Bamboo Organ Las Piñas, while World Trade Center Metro Manila is 6.8 mi away. The nearest airport is Manila Ninoy Aquino International Airport, 3.7 mi from the accommodations. ","['Free WiFi Internet Access Included', 'Family Rooms', 'Free WiFi Internet Access Included', 'Family Rooms']",77,"['8.7', '7.7', '8.1', '8.1', '8.2', '7.8', '8.1']","['Staff', 'Facilities', 'Cleanliness', 'Comfort', 'Value for money', 'Location', 'Free WiFi']","{'Staff': '8.7', 'Facilities': '7.7', 'Cleanliness': '8.1', 'Comfort': '8.1', 'Value for money': '8.2', 'Location': '7.8', 'Free WiFi': '8.1'}","['BHRA', 'Dona Julita Basketball Court', 'Vergonville Park', 'Bamboo Organ Park', 'Plaza Rizal', 'Talaba Cockpit', 'Jasmin Circle open-court and park', 'Las Piñas-Parañaque Critical Habitat and Ecotourism Area', 'Philamlife Village Park', 'Sta. Cecilia Park', 'Restaurant', 'Restaurant', 'Restaurant', 'Manila Zoological and Botanical Garden', 'Ninoy Aquino Monument', 'GT International Tower', 'Museo Pambata', 'National Museum of the Philippines', 'Intramuros', 'Fort Santiago', 'Malacanang Palace', 'Ocean/Sea', 'Mountain', 'Train', 'Train', 'Subway', 'Subway', 'Ninoy Aquino International Airport', 'Subic Bay Airport', 'Clark International Airport']","['1 km', '1.3 km', '1.5 km', '1.7 km', '1.7 km', '1.7 km', '1.7 km', '2.4 km', '2.7 km', '3.3 km', '350 m', '600 m', '600 m', '11 km', '11 km', '11 km', '12 km', '13 km', '13 km', '14 km', '14 km', '9 km', '45 km', '650 m', '1 km', '8 km', '15 km', '7 km', '84 km', '91 km']","{'BHRA': '1 km', 'Dona Julita Basketball Court': '1.3 km', 'Vergonville Park': '1.5 km', 'Bamboo Organ Park': '1.7 km', 'Plaza Rizal': '1.7 km', 'Talaba Cockpit': '1.7 km', 'Jasmin Circle open-court and park': '1.7 km', 'Las Piñas-Parañaque Critical Habitat and Ecotourism Area': '2.4 km', 'Philamlife Village Park': '2.7 km', 'Sta. Cecilia Park': '3.3 km', 'Restaurant': '600 m', 'Manila Zoological and Botanical Garden': '11 km', 'Ninoy Aquino Monument': '11 km', 'GT International Tower': '11 km', 'Museo Pambata': '12 km', 'National Museum of the Philippines': '13 km', 'Intramuros': '13 km', 'Fort Santiago': '14 km', 'Malacanang Palace': '14 km', 'Ocean/Sea': '9 km', 'Mountain': '45 km', 'Train': '1 km', 'Subway': '15 km', 'Ninoy Aquino International Airport': '7 km', 'Subic Bay Airport': '84 km', 'Clark International Airport': '91 km'}","['Queen Room', 'Queen Room', 'Family Room', 'Family Room']","[987.0, 1311.0, 1480.0, 1966.0]",987.0,"['Bathroom', 'Media & Technology', 'Parking', 'Services', 'Safety & security', 'General', 'Languages Spoken']","[['Toilet paper', 'Guest bathroom', 'Private Bathroom', 'Toilet', 'Free toiletries', 'Shower'], ['Flat-screen TV', 'Satellite channels'], ['Daily housekeeping'], ['Fire extinguishers', 'CCTV in common areas', 'Smoke alarms', 'Security alarm', 'Key access', '24-hour security'], ['Air conditioning', 'Family rooms'], ['English', 'Filipino']]",https://www.booking.com/hotel/ph/reddoorz-plus-near-bamboo-organ-las-pinas.html?label=gen173nr-1FCAEoggI46AdIM1gEaLQBiAEBmAEJuAEXyAEM2AEB6AEB-AELiAIBqAIDuALa9-ebBsACAdICJDNiMWUxMTlhLTc3ODEtNGI3NC05MWVlLTQ5MDA0MDQzYzY5NNgCBuACAQ&sid=b3a20c12be6b3d4d9b1b0a71b11d8898&aid=304142&ucfs=1&arphpl=1&checkin=2022-12-01&checkout=2022-12-02&dest_id=-2437894&dest_type=city&group_adults=2&req_adults=2&no_rooms=1&group_children=0&req_children=0&hpos=22&hapos=197&sr_order=popularity&nflt=ht_id%3D204&srpvid=7ca3572c9035002e&srepoch=1669119877&all_sr_blocks=540108001_276397865_0_0_0&highlighted_blocks=540108001_276397865_0_0_0&matching_block_id=540108001_276397865_0_0_0&sr_pri_blocks=540108001_276397865_0_0_0__97174&from=searchresults#hotelTmpl
RedDoorz Plus @ Kamuning Quezon City,3,"20 Kamuning Road, Quezon City, 1100 Manila, Philippines",7.3,"You're eligible for a Genius discount at RedDoorz Plus @ Kamuning Quezon City! To save at this property, all you have to do is  Well set in the Quezon City district of Manila, RedDoorz Plus @ Kamuning Quezon City is located 2.7 km from Smart Araneta Coliseum, 7.4 km from Shangri-La Plaza and 7.7 km from SM Megamall. The 3-star hotel has air-conditioned rooms with a private bathroom and free WiFi. Local points of interest like Manila Cathedral and Rizal Park are reachable within 9.8 km and 6.3 miles, respectively. All guest rooms in the hotel are equipped with a TV. At RedDoorz Plus @ Kamuning Quezon City every room has bed linen and towels. Languages spoken at the reception include English and Filipino, and guests are invited to request guidance on the area when needed. Malacanang Palace is 7.9 km from the accommodation, while Intramuros is 9.3 km away. The nearest airport is Ninoy Aquino International Airport, 19.3 km from RedDoorz Plus @ Kamuning Quezon City. ","['Non Smoking Rooms', 'Free WiFi Internet Access Included', '24 hour Front Desk', 'Non Smoking Rooms', 'Free WiFi Internet Access Included', '24 hour Front Desk']",98,"['7.5', '7.3', '7.5', '7.9', '7.8', '8.4', '6.6']","['Staff', 'Facilities', 'Cleanliness', 'Comfort', 'Value for money', 'Location', 'Free WiFi']","{'Staff': '7.5', 'Facilities': '7.3', 'Cleanliness': '7.5', 'Comfort': '7.9', 'Value for money': '7.8', 'Location': '8.4', 'Free WiFi': '6.6'}","['Barangay Mariana Park', 'Robinsons Magnolia Park', 'Remedios C. Samala Park', 'San Martin de Porres Barangay Covered Court', 'Diwa ng 1896', 'The Oval', 'Friendship Grandstand', 'Solea', 'Talayan Park', 'Quezon City Hall Park and Lagoon', 'Restaurant', 'Cafe/Bar', 'Restaurant', 'Restaurant', 'Cafe/Bar', 'Cafe/Bar', 'Quezon Memorial Circle', 'Malacanang Palace', 'National Museum of the Philippines', 'Intramuros', 'GT International Tower', 'Fort Santiago', 'Museo Pambata', 'Manila Zoological and Botanical Garden', 'Pinto Art Museum', 'Casa Santa Museum', 'Ocean/Sea', 'Manila Bay Beach', 'Train', 'Subway', 'Subway', 'Train', 'Ninoy Aquino International Airport', 'Clark International Airport', 'Subic Bay Airport']","['850 m', '1.5 km', '1.8 km', '1.9 km', '2.4 km', '2.6 km', '2.7 km', '2.7 km', '2.7 km', '2.7 km', '100 m', '100 m', '150 m', '150 m', '200 m', '200 m', '3.1 km', '6 km', '7 km', '8 km', '8 km', '8 km', '8 km', '9 km', '15 km', '16 km', '10 km', '8 km', '1.2 km', '1.3 km', '1.6 km', '1.7 km', '13 km', '81 km', '84 km']","{'Barangay Mariana Park': '850 m', 'Robinsons Magnolia Park': '1.5 km', 'Remedios C. Samala Park': '1.8 km', 'San Martin de Porres Barangay Covered Court': '1.9 km', 'Diwa ng 1896': '2.4 km', 'The Oval': '2.6 km', 'Friendship Grandstand': '2.7 km', 'Solea': '2.7 km', 'Talayan Park': '2.7 km', 'Quezon City Hall Park and Lagoon': '2.7 km', 'Restaurant': '150 m', 'Cafe/Bar': '200 m', 'Quezon Memorial Circle': '3.1 km', 'Malacanang Palace': '6 km', 'National Museum of the Philippines': '7 km', 'Intramuros': '8 km', 'GT International Tower': '8 km', 'Fort Santiago': '8 km', 'Museo Pambata': '8 km', 'Manila Zoological and Botanical Garden': '9 km', 'Pinto Art Museum': '15 km', 'Casa Santa Museum': '16 km', 'Ocean/Sea': '10 km', 'Manila Bay Beach': '8 km', 'Train': '1.7 km', 'Subway': '1.6 km', 'Ninoy Aquino International Airport': '13 km', 'Clark International Airport': '81 km', 'Subic Bay Airport': '84 km'}","['Studio', 'Studio', 'Executive Suite', 'Executive Suite']","[1087.0, 1434.0, 4613.0, 6089.0]",1087.0,"['Bathroom', 'Bedroom', 'Media & Technology', 'Parking', 'Services', 'Safety & security', 'General', 'Languages Spoken']","[['Toilet paper', 'Towels', 'Towels/Sheets (extra fee)', 'Private Bathroom', 'Toilet', 'Free toiletries', 'Shower'], ['Linens'], ['TV'], ['24-hour front desk'], ['Fire extinguishers', 'Smoke alarms'], ['Air conditioning', 'Non-smoking rooms'], ['English', 'Filipino']]",https://www.booking.com/hotel/ph/reddoorz-plus-kamuning-quezon-city.html?label=gen173nr-1FCAEoggI46AdIM1gEaLQBiAEBmAEJuAEXyAEM2AEB6AEB-AELiAIBqAIDuALa9-ebBsACAdICJDNiMWUxMTlhLTc3ODEtNGI3NC05MWVlLTQ5MDA0MDQzYzY5NNgCBuACAQ&sid=b3a20c12be6b3d4d9b1b0a71b11d8898&aid=304142&ucfs=1&arphpl=1&checkin=2022-12-01&checkout=2022-12-02&dest_id=-2437894&dest_type=city&group_adults=2&req_adults=2&no_rooms=1&group_children=0&req_children=0&hpos=24&hapos=199&sr_order=popularity&nflt=ht_id%3D204&srpvid=7ca3572c9035002e&srepoch=1669119877&all_sr_blocks=450177001_278242603_2_0_0&highlighted_blocks=450177001_278242603_2_0_0&matching_block_id=450177001_278242603_2_0_0&sr_pri_blocks=450177001_278242603_2_0_0__110438&from=searchresults#hotelTmpl
